id,name,colour,brandName,imageUrl
203316647,ASOS Weekend Collective sweatpants with hotfix monogram in black,Black,ASOS WEEKEND COLLECTIVE,https://images.asos-media.com/products/asos-weekend-collective-sweatpants-with-hotfix-monogram-in-black/203316647-1-black
203456320,ASOS DESIGN cord mini shirt dress with buckle in khaki,Khaki,ASOS DESIGN,https://images.asos-media.com/products/asos-design-cord-mini-shirt-dress-with-buckle-in-khaki/203456320-1-khaki
203577123,ASOS DESIGN textured long sleeve bodycon midi dress in mono check,Mono check,ASOS DESIGN,https://images.asos-media.com/products/asos-design-textured-long-sleeve-bodycon-midi-dress-in-mono-check/203577123-1-monocheck
203784642,Topshop Premium Limited Edition extended shoulder blazer in black,Black,Topshop,https://images.asos-media.com/products/topshop-premium-limited-edition-extended-shoulder-blazer-in-black/203784642-1-black
203784689,Topshop Curve Premium Limited Edition flared pants in blue,BLUE,Topshop,https://images.asos-media.com/products/topshop-curve-premium-limited-edition-flared-pants-in-blue/203784689-1-blue
203939059,ASOS DESIGN embellished wrap front tulle skirt midaxi dress with floral detail in lilac,Lilac,ASOS DESIGN,https://images.asos-media.com/products/asos-design-embellished-wrap-front-tulle-skirt-midaxi-dress-with-floral-detail-in-lilac/203939059-1-lilac
204003928,Motel strap detail slinky cowl neck mini dress in steel gray,Gray,Motel,https://images.asos-media.com/products/motel-strap-detail-slinky-cowl-neck-mini-dress-in-steel-gray/204003928-1-grey
204337146,Topshop channeled chuck on mini dress in red rose print,Multi,Topshop,https://images.asos-media.com/products/topshop-channeled-chuck-on-mini-dress-in-red-rose-print/204337146-1-multi
204338368,ASOS DESIGN embellished mini dress with cross detail drip beading in turquoise,Turquoise,ASOS DESIGN,https://images.asos-media.com/products/asos-design-embellished-mini-dress-with-cross-detail-drip-beading-in-turquoise/204338368-1-turquoise
205157816,ASOS LUXE pearl embellished wide leg belted pants in blush pink,Pink,ASOS Luxe,https://images.asos-media.com/products/asos-luxe-pearl-embellished-wide-leg-belted-pants-in-blush-pink/205157816-1-pink
205157840,ASOS LUXE pearl embellished puff sleeve caged mini dress in pink,Pink,ASOS Luxe,https://images.asos-media.com/products/asos-luxe-pearl-embellished-puff-sleeve-caged-mini-dress-in-pink/205157840-1-pink
205199748,ASOS DESIGN corset style sweetheart neck mesh bodysuit in black,Black,ASOS DESIGN,https://images.asos-media.com/products/asos-design-corset-style-sweetheart-neck-mesh-bodysuit-in-black/205199748-1-black
205534487,Nike fitted baby T-shirt in black,Black,Nike,https://images.asos-media.com/products/nike-fitted-baby-t-shirt-in-black/205534487-1-black
205534599,Nike fitted baby T-shirt in white,Black,Nike,https://images.asos-media.com/products/nike-fitted-baby-t-shirt-in-white/205534599-1-black
205537281,Nike One Training Dri-Fit stitch detail ribbed tank top in purple,Gray,Nike Training,https://images.asos-media.com/products/nike-one-training-dri-fit-stitch-detail-ribbed-tank-top-in-purple/205537281-1-grey
205563610,ASOS DESIGN knitted tank top with high halter neck in white,WHITE,ASOS DESIGN,https://images.asos-media.com/products/asos-design-knitted-tank-top-with-high-halter-neck-in-white/205563610-1-white
205567260,ASOS DESIGN cropped soft wide leg jeans in light blue,LIGHT BLUE,ASOS DESIGN,https://images.asos-media.com/products/asos-design-cropped-soft-wide-leg-jeans-in-light-blue/205567260-1-lightblue
205572257,ASOS DESIGN soft tailored jeans in dark blue,Dark blue,ASOS DESIGN,https://images.asos-media.com/products/asos-design-soft-tailored-jeans-in-dark-blue/205572257-1-darkblue
205580007,COLLUSION lettuce hem knit tank top in black,Black,Collusion,https://images.asos-media.com/products/collusion-lettuce-hem-knit-tank-top-in-black/205580007-1-black
205580017,COLLUSION lettuce hem knitted tank top in blue,BLUE,Collusion,https://images.asos-media.com/products/collusion-lettuce-hem-knitted-tank-top-in-blue/205580017-1-blue
205606341,ASOS DESIGN crochet swing tiered mini dress in cream,CREAM,ASOS DESIGN,https://images.asos-media.com/products/asos-design-crochet-swing-tiered-mini-dress-in-cream/205606341-1-cream
205622908,Topshop ruffle detail cami midi dress in vintage floral print,multi,Topshop,https://images.asos-media.com/products/topshop-ruffle-detail-cami-midi-dress-in-vintage-floral-print/205622908-1-multi
205623302,Topshop flutter sleeve mini tea dress in vintage blue floral print,multi,Topshop,https://images.asos-media.com/products/topshop-flutter-sleeve-mini-tea-dress-in-vintage-blue-floral-print/205623302-1-multi
205623346,Topshop cowl neck slip mini dress with 3D ruffle sleeve in pink floral print,pink,Topshop,https://images.asos-media.com/products/topshop-cowl-neck-slip-mini-dress-with-3d-ruffle-sleeve-in-pink-floral-print/205623346-1-pink
205644918,Topshop floral strappy linen mix mini dress in yellow,yellow,Topshop,https://images.asos-media.com/products/topshop-floral-strappy-linen-mix-mini-dress-in-yellow/205644918-1-yellow
205645255,Topshop jacquard maxi slip dress in white,white,Topshop,https://images.asos-media.com/products/topshop-jacquard-maxi-slip-dress-in-white/205645255-1-white
205658776,Topshop premium jacquard midi slip dress in pink and orange,pink,Topshop,https://images.asos-media.com/products/topshop-premium-jacquard-midi-slip-dress-in-pink-and-orange/205658776-1-pink
205665887,Topshop jacquard maxi slip dress in mono polka dot,black,Topshop,https://images.asos-media.com/products/topshop-jacquard-maxi-slip-dress-in-mono-polka-dot/205665887-1-black
205666886,Miss Selfridge sleeveless button shirt dress in light blue wash,BLUE,Miss Selfridge,https://images.asos-media.com/products/miss-selfridge-sleeveless-button-shirt-dress-in-light-blue-wash/205666886-1-blue
205676399,Topshop Tall denim comfort stretch shorts in bleach,Vintage blue,Topshop Tall,https://images.asos-media.com/products/topshop-tall-denim-comfort-stretch-shorts-in-bleach/205676399-1-vintageblue
205677647,ASOS DESIGN Petite corset plunge pleated mini dress with button detail in dusky rose,Dusky Rose,ASOS Petite,https://images.asos-media.com/products/asos-design-petite-corset-plunge-pleated-mini-dress-with-button-detail-in-dusky-rose/205677647-1-duskyrose
205683941,River Island midi sweater dress in cream,Black,River Island,https://images.asos-media.com/products/river-island-midi-sweater-dress-in-cream/205683941-1-black
205685029,Topshop halter neck mini dress in mono bandana print,multi,Topshop,https://images.asos-media.com/products/topshop-halter-neck-mini-dress-in-mono-bandana-print/205685029-1-multi
205685061,Topshop halter neck mini dress in black,black,Topshop,https://images.asos-media.com/products/topshop-halter-neck-mini-dress-in-black/205685061-1-black
205685789,Topshop Bella mini tea dress with flutter sleeve in black and white spot print,Mono,Topshop,https://images.asos-media.com/products/topshop-bella-mini-tea-dress-with-flutter-sleeve-in-black-and-white-spot-print/205685789-1-mono
205690445,ASOS DESIGN Tall flutter sleeve scoop neck bias paneled maxi dress in khaki,Khaki,ASOS Tall,https://images.asos-media.com/products/asos-design-tall-flutter-sleeve-scoop-neck-bias-paneled-maxi-dress-in-khaki/205690445-1-khaki
205690482,ASOS DESIGN Curve long sleeve ruffle maxi dress with lace inserts in mono floral print,Mono floral,ASOS Curve,https://images.asos-media.com/products/asos-design-curve-long-sleeve-ruffle-maxi-dress-with-lace-inserts-in-mono-floral-print/205690482-1-monofloral
205694207,ASOS 4505 one shoulder tank top in high shine black,Black,ASOS 4505,https://images.asos-media.com/products/asos-4505-one-shoulder-tank-top-in-high-shine-black/205694207-1-black
205695335,ASOS 4505 Court flippy skirt with inner shorts in white,White,ASOS 4505,https://images.asos-media.com/products/asos-4505-court-flippy-skirt-with-inner-shorts-in-white/205695335-1-white
205697167,ASOS LUXE 3D floral embellished mini dress with scallop hem and drop pearl detail in blue,Blue,ASOS Luxe,https://images.asos-media.com/products/asos-luxe-3d-floral-embellished-mini-dress-with-scallop-hem-and-drop-pearl-detail-in-blue/205697167-1-blue
205697238,ASOS DESIGN Bridesmaids flutter sleeve bias maxi dress with godet frill hem in pastel yellow,Pastel Yellow,ASOS DESIGN,https://images.asos-media.com/products/asos-design-bridesmaids-flutter-sleeve-bias-maxi-dress-with-godet-frill-hem-in-pastel-yellow/205697238-1-pastelyellow
205705052,ASOS DESIGN textured tie front long sleeve shirt in white - part of a set,White,ASOS DESIGN,https://images.asos-media.com/products/asos-design-textured-tie-front-long-sleeve-shirt-in-white-part-of-a-set/205705052-1-white
205708973,ASOS DESIGN tiered mini tea dress with pleated bodice in apple green satin,Apple green,ASOS DESIGN,https://images.asos-media.com/products/asos-design-tiered-mini-tea-dress-with-pleated-bodice-in-apple-green-satin/205708973-1-applegreen
205709228,Topshop knit crochet shell suit vest in stone,STONE,Topshop,https://images.asos-media.com/products/topshop-knit-crochet-shell-suit-vest-in-stone/205709228-1-stone
205709493,ASOS DESIGN Bridesmaids ruffle cami bias maxi dress in yellow,YELLOW,ASOS DESIGN,https://images.asos-media.com/products/asos-design-bridesmaids-ruffle-cami-bias-maxi-dress-in-yellow/205709493-1-yellow
205715814,ASOS DESIGN crochet swing tiered mini dress in khaki,Khaki,ASOS DESIGN,https://images.asos-media.com/products/asos-design-crochet-swing-tiered-mini-dress-in-khaki/205715814-1-khaki
205730039,ASOS DESIGN Curve seamed maxi tennis sundress in rust,RUST,ASOS Curve,https://images.asos-media.com/products/asos-design-curve-seamed-maxi-tennis-sundress-in-rust/205730039-1-rust
205731792,ASOS DESIGN cami ruched bust midi dress with tie front in red,RED,ASOS DESIGN,https://images.asos-media.com/products/asos-design-cami-ruched-bust-midi-dress-with-tie-front-in-red/205731792-1-red
205745307,ASOS DESIGN textured tassel tie waist flippy shorts in white - part of a set,White,ASOS DESIGN,https://images.asos-media.com/products/asos-design-textured-tassel-tie-waist-flippy-shorts-in-white-part-of-a-set/205745307-1-white
205747525,Miss Selfridge lace wide sleeve maxi kimono in black,Black,Miss Selfridge,https://images.asos-media.com/products/miss-selfridge-lace-wide-sleeve-maxi-kimono-in-black/205747525-1-black
205754198,ASOS DESIGN racer neck Crosshatch linen look jumpsuit in almond,Almond,ASOS DESIGN,https://images.asos-media.com/products/asos-design-racer-neck-crosshatch-linen-look-jumpsuit-in-almond/205754198-1-almond
205764987,Topshop soft touch twist low rise maxi skirt in sand,Sand,Topshop,https://images.asos-media.com/products/topshop-soft-touch-twist-low-rise-maxi-skirt-in-sand/205764987-1-sand
205765619,ASOS DESIGN suede look top collar jacket in chocolate,Chocolate,ASOS DESIGN,https://images.asos-media.com/products/asos-design-suede-look-top-collar-jacket-in-chocolate/205765619-1-chocolate
205765643,ASOS DESIGN tailored bomber jacket with clean hem in navy,Navy,ASOS DESIGN,https://images.asos-media.com/products/asos-design-tailored-bomber-jacket-with-clean-hem-in-navy/205765643-1-navy
205767010,Miss Selfridge stripe crochet maxi dress in multi,Multi,Miss Selfridge,https://images.asos-media.com/products/miss-selfridge-stripe-crochet-maxi-dress-in-multi/205767010-1-multi
205767967,Miss Selfridge textured tiered maxi slip dress in soft pink,Soft Pink,Miss Selfridge,https://images.asos-media.com/products/miss-selfridge-textured-tiered-maxi-slip-dress-in-soft-pink/205767967-1-softpink
205768138,Miss Selfridge linen mix stripe pull on tapered pants in natural,Stone,Miss Selfridge,https://images.asos-media.com/products/miss-selfridge-linen-mix-stripe-pull-on-tapered-pants-in-natural/205768138-1-stone
205768889,Miss Selfridge poplin shirred puffball mini dress in cream spot,Cream,Miss Selfridge,https://images.asos-media.com/products/miss-selfridge-poplin-shirred-puffball-mini-dress-in-cream-spot/205768889-1-cream
205769600,Miss Selfridge fitted vest in ivory - part of a set,Ivory,Miss Selfridge,https://images.asos-media.com/products/miss-selfridge-fitted-vest-in-ivory-part-of-a-set/205769600-1-ivory
205769741,Miss Selfridge turnback waistband wide leg pants in blue gray - part of a set,Light Gray,Miss Selfridge,https://images.asos-media.com/products/miss-selfridge-turnback-waistband-wide-leg-pants-in-blue-gray-part-of-a-set/205769741-1-lightgrey
205772347,ASOS DESIGN Petite ruched bust maxi sundress with adjustable straps in lime,Lime,ASOS Petite,https://images.asos-media.com/products/asos-design-petite-ruched-bust-maxi-sundress-with-adjustable-straps-in-lime/205772347-1-lime
205773216,ASOS DESIGN tie up cuff belted linen look maxi dress in oatmeal,Oatmeal,ASOS DESIGN,https://images.asos-media.com/products/asos-design-tie-up-cuff-belted-linen-look-maxi-dress-in-oatmeal/205773216-1-oatmeal
205780206,Calvin Klein intense power lounge sleep short in charcoal gray,Gray,Calvin Klein,https://images.asos-media.com/products/calvin-klein-intense-power-lounge-sleep-short-in-charcoal-gray/205780206-1-grey
205781268,NA Topshop knit cable crew neck mini dress in ivory,IVORY,Topshop,https://images.asos-media.com/products/na-topshop-knit-cable-crew-neck-mini-dress-in-ivory/205781268-1-ivory
205794589,ASOS DESIGN chino pants in stone,Stone,ASOS DESIGN,https://images.asos-media.com/products/asos-design-chino-pants-in-stone/205794589-1-stone
205800734,ASOS DESIGN Curve wrap front ruffle maxi dress with high split detail in abstract print,Abstract print,ASOS Curve,https://images.asos-media.com/products/asos-design-curve-wrap-front-ruffle-maxi-dress-with-high-split-detail-in-abstract-print/205800734-1-abstractprint
205800746,ASOS DESIGN Curve wrap front ruffle maxi dress with high split detail in purple,PURPLE,ASOS Curve,https://images.asos-media.com/products/asos-design-curve-wrap-front-ruffle-maxi-dress-with-high-split-detail-in-purple/205800746-1-purple
205804878,Calvin Klein CK 96 fashion cotton unlined bralette in black,Black,Calvin Klein,https://images.asos-media.com/products/calvin-klein-ck-96-fashion-cotton-unlined-bralette-in-black/205804878-1-black
205806072,ASOS DESIGN linen-look flutter sleeve midi dress with ruching detail in navy,NAVY,ASOS DESIGN,https://images.asos-media.com/products/asos-design-linen-look-flutter-sleeve-midi-dress-with-ruching-detail-in-navy/205806072-1-navy
205806082,ASOS DESIGN linen-look flutter sleeve midi dress with ruching detail in tan,BEIGE,ASOS DESIGN,https://images.asos-media.com/products/asos-design-linen-look-flutter-sleeve-midi-dress-with-ruching-detail-in-tan/205806082-1-beige
205806098,ASOS DESIGN linen-look flutter sleeve mini dress with ruching detail in spearmint,Spearmint,ASOS DESIGN,https://images.asos-media.com/products/asos-design-linen-look-flutter-sleeve-mini-dress-with-ruching-detail-in-spearmint/205806098-1-spearmint
205818999,ASOS DESIGN bandeau gathered waist satin mini dress in color block print,BRIGHT ABSTRACT,ASOS DESIGN,https://images.asos-media.com/products/asos-design-bandeau-gathered-waist-satin-mini-dress-in-color-block-print/205818999-1-brightabstract
205823211,ASOS DESIGN Petite knit tank with sporty tipping in blue,BLUE,ASOS Petite,https://images.asos-media.com/products/asos-design-petite-knit-tank-with-sporty-tipping-in-blue/205823211-1-blue
205823236,ASOS DESIGN knit tank with sporty tipping in white,WHITE,ASOS DESIGN,https://images.asos-media.com/products/asos-design-knit-tank-with-sporty-tipping-in-white/205823236-1-white
205824002,ASOS DESIGN pull on barrel leg pants in stone co-ord,Stone,ASOS DESIGN,https://images.asos-media.com/products/asos-design-pull-on-barrel-leg-pants-in-stone-co-ord/205824002-1-stone
205826143,ASOS 4505 Maternity Icon seamless rib gym legging in black,Black,ASOS 4505,https://images.asos-media.com/products/asos-4505-maternity-icon-seamless-rib-gym-legging-in-black/205826143-1-black
205826809,Only ribbed top with open heart detail in white,Cloud Dancer,ONLY,https://images.asos-media.com/products/only-ribbed-top-with-open-heart-detail-in-white/205826809-1-clouddancer
205830539,ASOS DESIGN Petite lace cut out dress button up ruffle hem midi dress in black floral print,Black Floral Print,ASOS Petite,https://images.asos-media.com/products/asos-design-petite-lace-cut-out-dress-button-up-ruffle-hem-midi-dress-in-black-floral-print/205830539-1-blackfloralprint
205849833,ASOS EDITION wavy one shoulder maxi dress in stone,Stone,ASOS EDITION,https://images.asos-media.com/products/asos-edition-wavy-one-shoulder-maxi-dress-in-stone/205849833-1-stone
205851833,Topshop baggy jeans in mid blue,Mid Blue,Topshop,https://images.asos-media.com/products/topshop-baggy-jeans-in-mid-blue/205851833-1-midblue
205853507,Tommy Jeans half zip color block sweater in black,black,Tommy Jeans,https://images.asos-media.com/products/tommy-jeans-half-zip-color-block-sweater-in-black/205853507-1-black
205853721,Tommy Jeans ultra high slim mom jeans in mid wash,Mid Wash,Tommy Jeans,https://images.asos-media.com/products/tommy-jeans-ultra-high-slim-mom-jeans-in-mid-wash/205853721-1-midwash
205854111,Tommy Jeans Sophie low rise belted jeans in mid wash,Mid Wash,Tommy Jeans,https://images.asos-media.com/products/tommy-jeans-sophie-low-rise-belted-jeans-in-mid-wash/205854111-1-midwash
205854265,Tommy Jeans cropped slogan ringer T-shirt in white,white,Tommy Jeans,https://images.asos-media.com/products/tommy-jeans-cropped-slogan-ringer-t-shirt-in-white/205854265-1-white
205854318,Tommy Jeans Harper high rise cargo pants in beige,beige,Tommy Jeans,https://images.asos-media.com/products/tommy-jeans-harper-high-rise-cargo-pants-in-beige/205854318-1-beige
205854848,ASOS DESIGN collared linen look maxi tea dress with button front in stone,STONE,ASOS DESIGN,https://images.asos-media.com/products/asos-design-collared-linen-look-maxi-tea-dress-with-button-front-in-stone/205854848-1-stone
205856663,Topshop short sleeve slubby shirt in bright multi stripe,Multi,Topshop,https://images.asos-media.com/products/topshop-short-sleeve-slubby-shirt-in-bright-multi-stripe/205856663-1-multi
205861511,ASOS DESIGN corset detail bias midi dress with lace insert in patchwork floral print,Patchwork floral,ASOS DESIGN,https://images.asos-media.com/products/asos-design-corset-detail-bias-midi-dress-with-lace-insert-in-patchwork-floral-print/205861511-1-patchworkfloral
205870419,Topshop short sleeve slubby shirt in multi pink stripe,Multi,Topshop,https://images.asos-media.com/products/topshop-short-sleeve-slubby-shirt-in-multi-pink-stripe/205870419-1-multi
205872342,Pretty Lavish utility romper in black,Black,Pretty Lavish,https://images.asos-media.com/products/pretty-lavish-utility-romper-in-black/205872342-1-black
205872375,Pretty Lavish cut-out cotton mini dress in cream,Cream,Pretty Lavish,https://images.asos-media.com/products/pretty-lavish-cut-out-cotton-mini-dress-in-cream/205872375-1-cream
205877623,ASOS DESIGN satin cami wrap midaxi dress in lilac,LILAC,ASOS DESIGN,https://images.asos-media.com/products/asos-design-satin-cami-wrap-midaxi-dress-in-lilac/205877623-1-lilac
205881893,ASOS DESIGN Curve v neck with channeled waist maxi dress in black,Black,ASOS Curve,https://images.asos-media.com/products/asos-design-curve-v-neck-with-channeled-waist-maxi-dress-in-black/205881893-1-black
205884043,ASOS DESIGN sleeveless ribbed bodice with full hem maxi dress in washed navy,Washed Navy,ASOS DESIGN,https://images.asos-media.com/products/asos-design-sleeveless-ribbed-bodice-with-full-hem-maxi-dress-in-washed-navy/205884043-1-washednavy
205885806,JDY broderie sleeve top in white,CLOUD DANCER,JDY,https://images.asos-media.com/products/jdy-broderie-sleeve-top-in-white/205885806-1-clouddancer
205887740,ASOS Weekend Collective logo elastic waistband short in blue and white stripe,Blue & white,ASOS WEEKEND COLLECTIVE,https://images.asos-media.com/products/asos-weekend-collective-logo-elastic-waistband-short-in-blue-and-white-stripe/205887740-1-bluewhite
205888028,ASOS DESIGN denim cami dress with ribbed trim detail in mid wash blue,Mid wash blue,ASOS DESIGN,https://images.asos-media.com/products/asos-design-denim-cami-dress-with-ribbed-trim-detail-in-mid-wash-blue/205888028-1-midwashblue
205898229,ASOS DESIGN Curve pull on denim shorts in lightwash blue,LIGHT BLUE,ASOS Curve,https://images.asos-media.com/products/asos-design-curve-pull-on-denim-shorts-in-lightwash-blue/205898229-1-lightblue
205899500,Pretty Lavish foldover maxi skirt in stone - part of a set,Stone,Pretty Lavish,https://images.asos-media.com/products/pretty-lavish-foldover-maxi-skirt-in-stone-part-of-a-set/205899500-1-stone
205899598,Pretty Lavish linen mix button up top in stone - part of a set,Stone,Pretty Lavish,https://images.asos-media.com/products/pretty-lavish-linen-mix-button-up-top-in-stone-part-of-a-set/205899598-1-stone
205899644,Pretty Lavish cut-out cotton mini dress in biscuit,Biscuit,Pretty Lavish,https://images.asos-media.com/products/pretty-lavish-cut-out-cotton-mini-dress-in-biscuit/205899644-1-biscuit
205899704,Pretty Lavish asymmetric ruffle knit maxi dress in cream,Cream,Pretty Lavish,https://images.asos-media.com/products/pretty-lavish-asymmetric-ruffle-knit-maxi-dress-in-cream/205899704-1-cream
205899718,Pretty Lavish multiway cross over ruffle midaxi dress in deep coral,Deep Coral,Pretty Lavish,https://images.asos-media.com/products/pretty-lavish-multiway-cross-over-ruffle-midaxi-dress-in-deep-coral/205899718-1-deepcoral
205901163,ASOS DESIGN cami floral broderie skater mini dress in white,WHITE,ASOS DESIGN,https://images.asos-media.com/products/asos-design-cami-floral-broderie-skater-mini-dress-in-white/205901163-1-white
205902156,Miss Selfridge crochet fringe maxi dress in cream,CREAM,Miss Selfridge,https://images.asos-media.com/products/miss-selfridge-crochet-fringe-maxi-dress-in-cream/205902156-1-cream
205910740,ASOS DESIGN oxford shirt in buttermilk,Buttermilk stripe,ASOS DESIGN,https://images.asos-media.com/products/asos-design-oxford-shirt-in-buttermilk/205910740-1-buttermilkstripe
205910750,ASOS DESIGN ultimate cropped shirt in pink stripe,Red stripe,ASOS DESIGN,https://images.asos-media.com/products/asos-design-ultimate-cropped-shirt-in-pink-stripe/205910750-1-redstripe
205910766,ASOS DESIGN oxford shirt in oxblood stripe,Oxblood stripe,ASOS DESIGN,https://images.asos-media.com/products/asos-design-oxford-shirt-in-oxblood-stripe/205910766-1-oxbloodstripe
205910806,ASOS DESIGN ultimate cropped shirt in blue stripe,Blue stripe,ASOS DESIGN,https://images.asos-media.com/products/asos-design-ultimate-cropped-shirt-in-blue-stripe/205910806-1-bluestripe
205915254,Pretty Lavish multiway cross over ruffle midaxi dress in black,Black,Pretty Lavish,https://images.asos-media.com/products/pretty-lavish-multiway-cross-over-ruffle-midaxi-dress-in-black/205915254-1-black
205915386,Pretty Lavish halter ruffle maxi dress in cream,CREAM,Pretty Lavish,https://images.asos-media.com/products/pretty-lavish-halter-ruffle-maxi-dress-in-cream/205915386-1-lemon
205915513,Pretty Lavish linen look pinstripe jumpsuit in cream,Cream pinstripe,Pretty Lavish,https://images.asos-media.com/products/pretty-lavish-linen-look-pinstripe-jumpsuit-in-cream/205915513-1-creampinstripe
205915662,COLLUSION embroidered chiffon asymmetric mini dress in stone,STONE,Collusion,https://images.asos-media.com/products/collusion-embroidered-chiffon-asymmetric-mini-dress-in-stone/205915662-1-stone
205915844,Pretty Lavish utility romper in beige,Beige,Pretty Lavish,https://images.asos-media.com/products/pretty-lavish-utility-romper-in-beige/205915844-1-beige
205915950,Pretty Lavish linen look ruched front mini dress in cream,Cream,Pretty Lavish,https://images.asos-media.com/products/pretty-lavish-linen-look-ruched-front-mini-dress-in-cream/205915950-1-cream
205917141,Miss Selfridge beach crochet fringe detail bandeau maxi dress in cream,CREAM,Miss Selfridge,https://images.asos-media.com/products/miss-selfridge-beach-crochet-fringe-detail-bandeau-maxi-dress-in-cream/205917141-1-cream
205917656,ASOS DESIGN linen look halter top with eyelet detail in white,White,ASOS DESIGN,https://images.asos-media.com/products/asos-design-linen-look-halter-top-with-eyelet-detail-in-white/205917656-1-white
205919957,ASOS DESIGN halter ruched maxi dress with lace insert and cut out in brown,BROWN,ASOS DESIGN,https://images.asos-media.com/products/asos-design-halter-ruched-maxi-dress-with-lace-insert-and-cut-out-in-brown/205919957-1-brown
205923507,ASOS DESIGN bias maxi skirt in lilac - part of a set,Lilac,ASOS DESIGN,https://images.asos-media.com/products/asos-design-bias-maxi-skirt-in-lilac-part-of-a-set/205923507-1-lilac
205928480,ASOS DESIGN wide strap channel waist midi sundress in red,RED,ASOS DESIGN,https://images.asos-media.com/products/asos-design-wide-strap-channel-waist-midi-sundress-in-red/205928480-1-red
205929547,ASOS DESIGN embellished batwing ergonomic maxi dress in ivory,IVORY,ASOS DESIGN,https://images.asos-media.com/products/asos-design-embellished-batwing-ergonomic-maxi-dress-in-ivory/205929547-1-ivory
205931349,ASOS DESIGN pull on boxer short in multi check,Check,ASOS DESIGN,https://images.asos-media.com/products/asos-design-pull-on-boxer-short-in-multi-check/205931349-1-check
205933032,ASOS DESIGN knit bobble stitch cardigan in white,WHITE,ASOS DESIGN,https://images.asos-media.com/products/asos-design-knit-bobble-stitch-cardigan-in-white/205933032-1-white
205939282,ASOS EDITION extreme chiffon gathered waist maxi dress monochrome stripe print,Monochrome Stripe Print,ASOS EDITION,https://images.asos-media.com/products/asos-edition-extreme-chiffon-gathered-waist-maxi-dress-monochrome-stripe-print/205939282-1-monostripeprint
205939906,ASOS DESIGN cami mini dress with ruching bust detailing in rust,RUST,ASOS DESIGN,https://images.asos-media.com/products/asos-design-cami-mini-dress-with-ruching-bust-detailing-in-rust/205939906-1-rust
