id,name,colour,brandName,imageUrl
206029628,Anaya twist tulle maxi dress in soft blue,Soft Blue,Anaya,https://images.asos-media.com/products/anaya-twist-tulle-maxi-dress-in-soft-blue/206029628-1-softblue
206029652,Anaya Bridesmaid tulle one shoulder maxi dress in soft blue,Soft Blue,Anaya,https://images.asos-media.com/products/anaya-bridesmaid-tulle-one-shoulder-maxi-dress-in-soft-blue/206029652-1-softblue
206031608,Anaya Plus twist tulle maxi dress in soft blue,Soft Blue,Anaya Plus,https://images.asos-media.com/products/anaya-plus-twist-tulle-maxi-dress-in-soft-blue/206031608-1-softblue
206031629,Anaya Plus bridesmaid tulle one shoulder maxi dress in soft blue,Soft Blue,Anaya Plus,https://images.asos-media.com/products/anaya-plus-bridesmaid-tulle-one-shoulder-maxi-dress-in-soft-blue/206031629-1-softblue
206032512,Daisy Street cross back midi cami dress in pink ditsy print,Multi,Daisy Street,https://images.asos-media.com/products/daisy-street-cross-back-midi-cami-dress-in-pink-ditsy-print/206032512-1-multi
206034699,Reclaimed Vintage crochet floral knit dress,multi,Reclaimed Vintage,https://images.asos-media.com/products/reclaimed-vintage-crochet-floral-knit-dress/206034699-1-multi
206034712,Reclaimed Vintage crochet midi dress with flowers,cream,Reclaimed Vintage,https://images.asos-media.com/products/reclaimed-vintage-crochet-midi-dress-with-flowers/206034712-1-cream
206037032,Noisy May maxi T-shirt dress in washed gray,Charcoal gray,Noisy May,https://images.asos-media.com/products/noisy-may-maxi-t-shirt-dress-in-washed-gray/206037032-1-charcoalgray
206042079,ASOS DESIGN tie side bikini bottoms in abstract print,Postcard print,ASOS DESIGN,https://images.asos-media.com/products/asos-design-tie-side-bikini-bottoms-in-abstract-print/206042079-1-postcardprint
206042197,ASOS DESIGN triangle bikini top in postcard print,Postcard print,ASOS DESIGN,https://images.asos-media.com/products/asos-design-triangle-bikini-top-in-postcard-print/206042197-1-postcardprint
206057403,ASOS DESIGN shoulder pad column wide leg jumpsuit in blue,BLUE,ASOS DESIGN,https://images.asos-media.com/products/asos-design-shoulder-pad-column-wide-leg-jumpsuit-in-blue/206057403-1-blue
206063820,ASOS DESIGN Tall square neck tie back linen mix midi sundress in chocolate,Chocolate,ASOS Tall,https://images.asos-media.com/products/asos-design-tall-square-neck-tie-back-linen-mix-midi-sundress-in-chocolate/206063820-1-chocolate
206072503,Reclaimed Vintage floral crochet knit mini dress with asymmetric hem in pink,pink,Reclaimed Vintage,https://images.asos-media.com/products/reclaimed-vintage-floral-crochet-knit-mini-dress-with-asymmetric-hem-in-pink/206072503-1-pink
206112589,ASOS DESIGN bodycon one shoulder mini dress in ivory,IVORY,ASOS DESIGN,https://images.asos-media.com/products/asos-design-bodycon-one-shoulder-mini-dress-in-ivory/206112589-1-ivory
206116044,ASOS DESIGN Weekend Collective simple logo white T-shirt,WHITE,ASOS WEEKEND COLLECTIVE,https://images.asos-media.com/products/asos-design-weekend-collective-simple-logo-white-t-shirt/206116044-1-white
206119620,ASOS DESIGN ruched bandeau jumpsuit in sage green,SAGE GREEN,ASOS DESIGN,https://images.asos-media.com/products/asos-design-ruched-bandeau-jumpsuit-in-sage-green/206119620-1-sagegreen
206132352,Murci bandeau lace up mini dress in white,WHITE,Murci,https://images.asos-media.com/products/murci-bandeau-lace-up-mini-dress-in-white/206132352-1-white
206132456,Murci deep cowl neck fishtail maxi dress in fuchsia,Fuchsia,Murci,https://images.asos-media.com/products/murci-deep-cowl-neck-fishtail-maxi-dress-in-fuchsia/206132456-1-fuchsia
206132486,Murci exclusive mesh deep plunge ruffle trim high low maxi dress in pink,PINK,Murci,https://images.asos-media.com/products/murci-exclusive-mesh-deep-plunge-ruffle-trim-high-low-maxi-dress-in-pink/206132486-1-pink
206132510,Murci exclusive diamante cut out long sleeve maxi dress in white,WHITE,Murci,https://images.asos-media.com/products/murci-exclusive-diamante-cut-out-long-sleeve-maxi-dress-in-white/206132510-1-white
206132544,Murci mesh frill detail lace up plunge ultra mini dress in pink,PINK,Murci,https://images.asos-media.com/products/murci-mesh-frill-detail-lace-up-plunge-ultra-mini-dress-in-pink/206132544-1-pink
206141554,ASOS DESIGN high apex spun midi dress in ombre print,Ombre print,ASOS DESIGN,https://images.asos-media.com/products/asos-design-high-apex-spun-midi-dress-in-ombre-print/206141554-1-ombreprint
206145905,ASOS DESIGN Tall wide leg dad pants with linen in taupe,Taupe,ASOS Tall,https://images.asos-media.com/products/asos-design-tall-wide-leg-dad-pants-with-linen-in-taupe/206145905-1-taupe
206145960,ASOS DESIGN wide leg dad pants with linen in cream,Cream,ASOS DESIGN,https://images.asos-media.com/products/asos-design-wide-leg-dad-pants-with-linen-in-cream/206145960-1-cream
206155422,ASOS DESIGN Cindy high leg high waist bikini bottom in mono spot,Monochrome spot,ASOS DESIGN,https://images.asos-media.com/products/asos-design-cindy-high-leg-high-waist-bikini-bottom-in-mono-spot/206155422-1-monochromespot
206157830,Moda Minx x Savannah-Shae Richards knot front bikini top in red,Red,Moda Minx,https://images.asos-media.com/products/moda-minx-x-savannah-shae-richards-knot-front-bikini-top-in-red/206157830-1-red
206157910,Moda Minx x Savannah-Shae Richards valentina coin wrap waist triangle bikini top in black,Black,Moda Minx,https://images.asos-media.com/products/moda-minx-x-savannah-shae-richards-valentina-coin-wrap-waist-triangle-bikini-top-in-black/206157910-1-black
206157974,Moda Minx x Savannah-Shae Richards jade waist tie side bikini bottom in cobalt blue,Blue,Moda Minx,https://images.asos-media.com/products/moda-minx-x-savannah-shae-richards-jade-waist-tie-side-bikini-bottom-in-cobalt-blue/206157974-1-blue
206159266,Vero Moda halterneck maxi dress in mixed floral print,PINK,Vero Moda,https://images.asos-media.com/products/vero-moda-halterneck-maxi-dress-in-mixed-floral-print/206159266-1-pink
206159504,Vero Moda ribbed tank mini dress in black,Black,Vero Moda,https://images.asos-media.com/products/vero-moda-ribbed-tank-mini-dress-in-black/206159504-1-black
206159595,Vero Moda ribbed tank mini dress in navy,Navy Blazer,Vero Moda,https://images.asos-media.com/products/vero-moda-ribbed-tank-mini-dress-in-navy/206159595-1-navyblazer
206183066,COLLUSION motocross fitted maxi dress in red,RED,Collusion,https://images.asos-media.com/products/collusion-motocross-fitted-maxi-dress-in-red/206183066-1-red
206187747,Reclaimed Vintage denim jorts in ecru wash,ECRU,Reclaimed Vintage,https://images.asos-media.com/products/reclaimed-vintage-denim-jorts-in-ecru-wash/206187747-1-ecru
206187765,Reclaimed Vintage denim jorts in blue wash,Blue wash,Reclaimed Vintage,https://images.asos-media.com/products/reclaimed-vintage-denim-jorts-in-blue-wash/206187765-1-bluewash
206269690,& Other Stories racer back tank top in white,WHITE,& Other Stories,https://images.asos-media.com/products/other-stories-racer-back-tank-top-in-white/206269690-1-white
206271705,ASOS DESIGN asymmetric neckline mini dress in navy,NAVY,ASOS DESIGN,https://images.asos-media.com/products/asos-design-asymmetric-neckline-mini-dress-in-navy/206271705-1-navy
206275228,ASOS DESIGN pull on linen mix pants with tie side in black,Black,ASOS DESIGN,https://images.asos-media.com/products/asos-design-pull-on-linen-mix-pants-with-tie-side-in-black/206275228-1-black
206275238,ASOS DESIGN pull-on shorts with rick-rack trim in lemon print,Lemon print,ASOS DESIGN,https://images.asos-media.com/products/asos-design-pull-on-shorts-with-rick-rack-trim-in-lemon-print/206275238-1-lemonprint
206275278,ASOS DESIGN pull-on pants with tie side with linen in print,Multi,ASOS DESIGN,https://images.asos-media.com/products/asos-design-pull-on-pants-with-tie-side-with-linen-in-print/206275278-1-multi
206291921,Vila linen touch bomber jacket in natural heather,Natural melange,Vila,https://images.asos-media.com/products/vila-linen-touch-bomber-jacket-in-natural-heather/206291921-1-naturalmelange
206292030,Vila knit polo top in cream and black stripe,Black beauty,Vila,https://images.asos-media.com/products/vila-knit-polo-top-in-cream-and-black-stripe/206292030-1-blackbeauty
206301079,Vero Moda v neck eyelet jersey maxi dress in yellow,Mellow Yellow,Vero Moda,https://images.asos-media.com/products/vero-moda-v-neck-eyelet-jersey-maxi-dress-in-yellow/206301079-1-mellowyellow
206301081,Vero Moda wrap front mini dress in light blue floral,LIGHT BLUE,Vero Moda,https://images.asos-media.com/products/vero-moda-wrap-front-mini-dress-in-light-blue-floral/206301081-1-lightblue
206301305,Vero Moda knit racer neck swing dress in yellow,Mellow Yellow,Vero Moda,https://images.asos-media.com/products/vero-moda-knit-racer-neck-swing-dress-in-yellow/206301305-1-mellowyellow
206301417,Vero Moda knit racer neck swing dress in navy,Navy blazer,Vero Moda,https://images.asos-media.com/products/vero-moda-knit-racer-neck-swing-dress-in-navy/206301417-1-navyblazer
206301504,Vero Moda Petite knit racer swing dress in yellow,Mellow Yellow,Vero Moda Petite,https://images.asos-media.com/products/vero-moda-petite-knit-racer-swing-dress-in-yellow/206301504-1-mellowyellow
206301873,Vero Moda one shoulder ribbed jersey maxi dress in golden orange,ORANGE,Vero Moda,https://images.asos-media.com/products/vero-moda-one-shoulder-ribbed-jersey-maxi-dress-in-golden-orange/206301873-1-orange
206301925,Vero Moda crochet top in cream,CREAM,Vero Moda,https://images.asos-media.com/products/vero-moda-crochet-top-in-cream/206301925-1-cream
206308038,Only eyelet detail cropped blouse in black,Black,ONLY,https://images.asos-media.com/products/only-eyelet-detail-cropped-blouse-in-black/206308038-1-black
206315948,ASOS DESIGN cami with tie front bodice full skirt midi dress in blue,BLUE,ASOS DESIGN,https://images.asos-media.com/products/asos-design-cami-with-tie-front-bodice-full-skirt-midi-dress-in-blue/206315948-1-blue
206317986,ASOS DESIGN Curve Sheri high waist bikini bottoms in mono abstract,Mono abstract,ASOS Curve,https://images.asos-media.com/products/asos-design-curve-sheri-high-waist-bikini-bottoms-in-mono-abstract/206317986-1-monoabstract
206317995,ASOS DESIGN Sheri high leg hipster bikini bottoms in monochrome abstract,Mono abstract,ASOS DESIGN,https://images.asos-media.com/products/asos-design-sheri-high-leg-hipster-bikini-bottoms-in-monochrome-abstract/206317995-1-monoabstract
206318325,ASOS DESIGN Sheri crop bikini top in mono abstract,Mono abstract,ASOS DESIGN,https://images.asos-media.com/products/asos-design-sheri-crop-bikini-top-in-mono-abstract/206318325-1-monoabstract
206318345,ASOS DESIGN Curve Sheri crop bikini top in mono abstract,Mono abstract,ASOS Curve,https://images.asos-media.com/products/asos-design-curve-sheri-crop-bikini-top-in-mono-abstract/206318345-1-monoabstract
206318530,ASOS DESIGN Sheri square neck scoop back swimsuit in mono abstract,Mono abstract,ASOS DESIGN,https://images.asos-media.com/products/asos-design-sheri-square-neck-scoop-back-swimsuit-in-mono-abstract/206318530-1-monoabstract
206323692,ASOS DESIGN satin tie side mini skirt in black - part of a set,black,ASOS DESIGN,https://images.asos-media.com/products/asos-design-satin-tie-side-mini-skirt-in-black-part-of-a-set/206323692-1-black
206334679,& Other Stories fitted tank top in black,Black,& Other Stories,https://images.asos-media.com/products/other-stories-fitted-tank-top-in-black/206334679-1-black
206344376,Moda Minx x Savannah-Shae Richards coin sarong in black,Black,Moda Minx,https://images.asos-media.com/products/moda-minx-x-savannah-shae-richards-coin-sarong-in-black/206344376-1-black
206353913,ASOS DESIGN modesty plisse wrap neck long sleeve maxi dress in rust,RUST,ASOS DESIGN,https://images.asos-media.com/products/asos-design-modesty-plisse-wrap-neck-long-sleeve-maxi-dress-in-rust/206353913-1-rust
206364051,ASOS DESIGN satin ruched maxi skirt in blush - part of a set,blush,ASOS DESIGN,https://images.asos-media.com/products/asos-design-satin-ruched-maxi-skirt-in-blush-part-of-a-set/206364051-1-blush
206364091,ASOS DESIGN satin ruched cami top in blush - part of a set,blush,ASOS DESIGN,https://images.asos-media.com/products/asos-design-satin-ruched-cami-top-in-blush-part-of-a-set/206364091-1-blush
206372790,ASOS DESIGN mini linen mix bandeau sundress in blue,BLUE,ASOS DESIGN,https://images.asos-media.com/products/asos-design-mini-linen-mix-bandeau-sundress-in-blue/206372790-1-blue
206379011,ASOS DESIGN button down linen look midi dress with full skirt spot print,Spot Print,ASOS DESIGN,https://images.asos-media.com/products/asos-design-button-down-linen-look-midi-dress-with-full-skirt-spot-print/206379011-1-spotprint
206379107,Vesper notch detail cami strap thigh split midi dress in raspberry,Raspberry,Vesper,https://images.asos-media.com/products/vesper-notch-detail-cami-strap-thigh-split-midi-dress-in-raspberry/206379107-1-raspberry
206392152,Free People textured stretch camisole top in coral orange,Emberglow,Free People,https://images.asos-media.com/products/free-people-textured-stretch-camisole-top-in-coral-orange/206392152-1-emberglow
206399872,Pieces one shoulder top in white,WHITE,Pieces,https://images.asos-media.com/products/pieces-one-shoulder-top-in-white/206399872-1-white
206399921,Pieces mini shirt dress with tie waist in animal print,ANIMAL,Pieces,https://images.asos-media.com/products/pieces-mini-shirt-dress-with-tie-waist-in-animal-print/206399921-1-animal
206399939,Pieces wrap midi skirt in pink floral,Pink floral,Pieces,https://images.asos-media.com/products/pieces-wrap-midi-skirt-in-pink-floral/206399939-1-pinkfloral
206400075,Pieces cargo boilersuit in stone,STONE,Pieces,https://images.asos-media.com/products/pieces-cargo-boilersuit-in-stone/206400075-1-stone
206400205,Pieces scoop neck maxi dress in black,Black,Pieces,https://images.asos-media.com/products/pieces-scoop-neck-maxi-dress-in-black/206400205-1-black
206400334,Pieces woven mini skirt with contrast stitching in black,Black,Pieces,https://images.asos-media.com/products/pieces-woven-mini-skirt-with-contrast-stitching-in-black/206400334-1-black
206400368,Pieces scoop neck maxi dress in green,GREEN,Pieces,https://images.asos-media.com/products/pieces-scoop-neck-maxi-dress-in-green/206400368-1-green
206400403,Pieces towelling beach shorts in orange,ORANGE,Pieces,https://images.asos-media.com/products/pieces-towelling-beach-shorts-in-orange/206400403-1-orange
206400435,Pieces frill cami maxi dress in cream orange print,Orange print,Pieces,https://images.asos-media.com/products/pieces-frill-cami-maxi-dress-in-cream-orange-print/206400435-1-orangeprint
206400735,Pieces Petite frill cami maxi dress in blue ditsy floral,Blue ditsy,Pieces Petite,https://images.asos-media.com/products/pieces-petite-frill-cami-maxi-dress-in-blue-ditsy-floral/206400735-1-blueditsy
206400812,Pieces Tall frill bottom maxi dress in khaki,Khaki,Pieces Tall,https://images.asos-media.com/products/pieces-tall-frill-bottom-maxi-dress-in-khaki/206400812-1-khaki
206419712,ASOS DESIGN satin tuck detail maxi dress with ruched detail in red,RED,ASOS DESIGN,https://images.asos-media.com/products/asos-design-satin-tuck-detail-maxi-dress-with-ruched-detail-in-red/206419712-1-red
206423687,Object textured buttondown mini dress in off white,White Sand,Object,https://images.asos-media.com/products/object-textured-buttondown-mini-dress-in-off-white/206423687-1-whitesand
206423692,Object wide leg pants in tea green,Tea,Object,https://images.asos-media.com/products/object-wide-leg-pants-in-tea-green/206423692-1-tea
206423696,Object stretch jersey midi skirt with twist detail in off white,White Sand,Object,https://images.asos-media.com/products/object-stretch-jersey-midi-skirt-with-twist-detail-in-off-white/206423696-1-whitesand
206423774,Object fine knit open tie side tank top in tea green stripe,Tea,Object,https://images.asos-media.com/products/object-fine-knit-open-tie-side-tank-top-in-tea-green-stripe/206423774-1-tea
206436933,ASOS DESIGN knit beach shorts in blue & cream - part of a set,Blue & cream,ASOS DESIGN,https://images.asos-media.com/products/asos-design-knit-beach-shorts-in-blue-cream-part-of-a-set/206436933-1-bluecream
206436949,ASOS DESIGN knit beach shirt in blue & cream - part of a set,Blue & cream,ASOS DESIGN,https://images.asos-media.com/products/asos-design-knit-beach-shirt-in-blue-cream-part-of-a-set/206436949-1-bluecream
206460264,ASOS DESIGN micro jersey shorts in black,Black,ASOS DESIGN,https://images.asos-media.com/products/asos-design-micro-jersey-shorts-in-black/206460264-1-black
206473218,ASOS DESIGN U Scoop mini dress in blue panelled stripe,Multi Stripe,ASOS DESIGN,https://images.asos-media.com/products/asos-design-u-scoop-mini-dress-in-blue-panelled-stripe/206473218-1-multistripe
206485200,ASOS DESIGN second skin short sleeve scoop back midi dress in brown,Chocolate,ASOS DESIGN,https://images.asos-media.com/products/asos-design-second-skin-short-sleeve-scoop-back-midi-dress-in-brown/206485200-1-chocolate
206517240,Vero Moda strappy maxi dress in poppy red,Red,Vero Moda,https://images.asos-media.com/products/vero-moda-strappy-maxi-dress-in-poppy-red/206517240-1-red
206522738,Bershka textured cowl neck cut out mini dress in ecru,NEUTRAL,Bershka,https://images.asos-media.com/products/bershka-textured-cowl-neck-cut-out-mini-dress-in-ecru/206522738-1-neutral
206522926,Bershka poplin volume mini skirt in white,WHITE,Bershka,https://images.asos-media.com/products/bershka-poplin-volume-mini-skirt-in-white/206522926-1-white
206522985,Bershka strappy straight neck cami top in leopard print,Multi,Bershka,https://images.asos-media.com/products/bershka-strappy-straight-neck-cami-top-in-leopard-print/206522985-1-multi
206523062,Bershka ribbed strappy mini dress in pink,PINK,Bershka,https://images.asos-media.com/products/bershka-ribbed-strappy-mini-dress-in-pink/206523062-1-pink
206523131,Bershka thin strap bow detail bodycon maxi dress in pink,PINK,Bershka,https://images.asos-media.com/products/bershka-thin-strap-bow-detail-bodycon-maxi-dress-in-pink/206523131-1-pink
206523217,Bershka lettuce edge bandeau mini dress in khaki,GREEN,Bershka,https://images.asos-media.com/products/bershka-lettuce-edge-bandeau-mini-dress-in-khaki/206523217-1-green
206523242,Bershka low rise bootcut jeans in light blue dirty wash,BLUE,Bershka,https://images.asos-media.com/products/bershka-low-rise-bootcut-jeans-in-light-blue-dirty-wash/206523242-1-blue
206543380,Object wide leg fluid pants in snake print - part of a set,Raven AOP,Object,https://images.asos-media.com/products/object-wide-leg-fluid-pants-in-snake-print-part-of-a-set/206543380-1-ravenaop
206589194,ASOS DESIGN high low hem cut out dress with twist strap in black,Black,ASOS DESIGN,https://images.asos-media.com/products/asos-design-high-low-hem-cut-out-dress-with-twist-strap-in-black/206589194-1-black
206613867,Stradivarius boat neck top with ruched detail in khaki,Khaki,Stradivarius,https://images.asos-media.com/products/stradivarius-boat-neck-top-with-ruched-detail-in-khaki/206613867-1-khaki
206663958,Bershka textured halterneck knit maxi dress in orange,ORANGE,Bershka,https://images.asos-media.com/products/bershka-textured-halterneck-knit-maxi-dress-in-orange/206663958-1-orange
206683639,ASOS DESIGN cotton poplin smock dress in red,Red,ASOS DESIGN,https://images.asos-media.com/products/asos-design-cotton-poplin-smock-dress-in-red/206683639-1-red
206683648,ASOS DESIGN wide leg cotton poplin pants in gingham,Gingham,ASOS DESIGN,https://images.asos-media.com/products/asos-design-wide-leg-cotton-poplin-pants-in-gingham/206683648-1-gingham
206683669,ASOS DESIGN gingham mini skirt,Gingham,ASOS DESIGN,https://images.asos-media.com/products/asos-design-gingham-mini-skirt/206683669-1-gingham
206704632,ASOS DESIGN shirred micro shorts with lace trim in off white,ECRU,ASOS DESIGN,https://images.asos-media.com/products/asos-design-shirred-micro-shorts-with-lace-trim-in-off-white/206704632-1-ecru
206715720,Bershka racer neck top in chocolate and beige print,Multi,Bershka,https://images.asos-media.com/products/bershka-racer-neck-top-in-chocolate-and-beige-print/206715720-1-multi
206718177,Pull&Bear tailored mini skirt with belted wrap detail in blue,BLUE,Pull&Bear,https://images.asos-media.com/products/pullbear-tailored-mini-skirt-with-belted-wrap-detail-in-blue/206718177-1-blue
206746367,ASOS DESIGN slash neck t-shirt with contrast binding in white,Ivory,ASOS DESIGN,https://images.asos-media.com/products/asos-design-slash-neck-t-shirt-with-contrast-binding-in-white/206746367-1-ivory
206748151,Miss Selfridge scoop neck sleeveless wide leg jumpsuit in black,Black,Miss Selfridge,https://images.asos-media.com/products/miss-selfridge-scoop-neck-sleeveless-wide-leg-jumpsuit-in-black/206748151-1-black
206750038,Reclaimed Vintage mesh top with shoulder detail in leopard print,Multi,Reclaimed Vintage,https://images.asos-media.com/products/reclaimed-vintage-mesh-top-with-shoulder-detail-in-leopard-print/206750038-1-multi
206757159,Miss Selfridge red pointelle micro shorts,red,Miss Selfridge,https://images.asos-media.com/products/miss-selfridge-red-pointelle-micro-shorts/206757159-1-red
206757169,Miss Selfridge red pointelle milkmaid top,red,Miss Selfridge,https://images.asos-media.com/products/miss-selfridge-red-pointelle-milkmaid-top/206757169-1-red
206769805,COLLUSION rib tank top maxi dress in gray,Gray,Collusion,https://images.asos-media.com/products/collusion-rib-tank-top-maxi-dress-in-gray/206769805-1-grey
206782861,Reclaimed Vintage slit front tie-up top in white poplin,WHITE,Reclaimed Vintage,https://images.asos-media.com/products/reclaimed-vintage-slit-front-tie-up-top-in-white-poplin/206782861-1-white
206785245,COLLUSION slash neck tank top with ruffle hem in lime,LIGHT GREEN,Collusion,https://images.asos-media.com/products/collusion-slash-neck-tank-top-with-ruffle-hem-in-lime/206785245-1-lightgreen
206787215,COLLUSION shrunken T-shirt with V-neck and logo in green,DARK GREEN,Collusion,https://images.asos-media.com/products/collusion-shrunken-t-shirt-with-v-neck-and-logo-in-green/206787215-1-darkgreen
206787253,COLLUSION baby tee with contrast detail and logo in white and red,RED,Collusion,https://images.asos-media.com/products/collusion-baby-tee-with-contrast-detail-and-logo-in-white-and-red/206787253-1-red
206791769,Reclaimed Vintage baby T-shirt with cowboy graphics in white,WHITE,Reclaimed Vintage,https://images.asos-media.com/products/reclaimed-vintage-baby-t-shirt-with-cowboy-graphics-in-white/206791769-1-white
206791808,Reclaimed Vintage oversized T-shirt with cowboy hats in black,Black,Reclaimed Vintage,https://images.asos-media.com/products/reclaimed-vintage-oversized-t-shirt-with-cowboy-hats-in-black/206791808-1-black
205697046,Topshop ruched waistband full hem midi skirt in black,Black,Topshop,https://images.asos-media.com/products/topshop-ruched-waistband-full-hem-midi-skirt-in-black/205697046-1-black
205646626,Reclaimed Vintage sleeveless jumpsuit in green floral,Green floral,Reclaimed Vintage,https://images.asos-media.com/products/reclaimed-vintage-sleeveless-jumpsuit-in-green-floral/205646626-1-greenfloral
205768872,Miss Selfridge picot trim bias maxi skirt in multicolor floral,Multi,Miss Selfridge,https://images.asos-media.com/products/miss-selfridge-picot-trim-bias-maxi-skirt-in-multicolor-floral/205768872-1-multi
205924716,Hope & Ivy off shoulder maxi dress with shirred detail in bright floral,Multi,Hope & Ivy,https://images.asos-media.com/products/hope-ivy-off-shoulder-maxi-dress-with-shirred-detail-in-bright-floral/205924716-1-multi
205924557,Hope & Ivy high neck maxi dress with thigh split in khaki floral,Multi,Hope & Ivy,https://images.asos-media.com/products/hope-ivy-high-neck-maxi-dress-with-thigh-split-in-khaki-floral/205924557-1-multi
206043517,ASOS DESIGN camp collar cropped shirt in mosaic fruit print - part of a set,Multi,ASOS DESIGN,https://images.asos-media.com/products/asos-design-camp-collar-cropped-shirt-in-mosaic-fruit-print-part-of-a-set/206043517-1-multi
206124869,ASOS DESIGN wrap detail skort in mosaic fruit print - part of a set,Multi,ASOS DESIGN,https://images.asos-media.com/products/asos-design-wrap-detail-skort-in-mosaic-fruit-print-part-of-a-set/206124869-1-multi
200241953,Topshop active sculpt seamless contour leggings in black - part of a set,BLACK,Topshop,https://images.asos-media.com/products/topshop-active-sculpt-seamless-contour-leggings-in-black-part-of-a-set/200241953-1-black
200373619,Topshop square neck going out jumpsuit in black,Black,Topshop,https://images.asos-media.com/products/topshop-square-neck-going-out-jumpsuit-in-black/200373619-1-black
201708911,Topshop floral rose bias cut slit midi skirt in blue,BLUE,Topshop,https://images.asos-media.com/products/topshop-floral-rose-bias-cut-slit-midi-skirt-in-blue/201708911-1-blue
201762461,Topshop satin bias cut skirt in navy,NAVY,Topshop,https://images.asos-media.com/products/topshop-satin-bias-cut-skirt-in-navy/201762461-1-navy
202940639,ASOS DESIGN ladder detail beach maxi skirt in cobalt blue,BLUE,ASOS DESIGN,https://images.asos-media.com/products/asos-design-ladder-detail-beach-maxi-skirt-in-cobalt-blue/202940639-1-blue
203037253,Topshop mesh high neck one shoulder top in black,black,Topshop,https://images.asos-media.com/products/topshop-mesh-high-neck-one-shoulder-top-in-black/203037253-1-black
203080222,ASOS DESIGN sheer wrap front shirt with split sleeve in faded floral,Faded floral,ASOS DESIGN,https://images.asos-media.com/products/asos-design-sheer-wrap-front-shirt-with-split-sleeve-in-faded-floral/203080222-1-fadedfloral
203286135,ASOS DESIGN long sleeve cut out waist beach jumpsuit in black,Black,ASOS DESIGN,https://images.asos-media.com/products/asos-design-long-sleeve-cut-out-waist-beach-jumpsuit-in-black/203286135-1-black
